INDEX,1,2,3,4,5,6,7,8,9,10,11,12,13,14,15,16,17,18,19,20,21
0,제가 당신과 벨리 춤을 춰도 됩니까? ,넌 나의 방을 내일 청소해도 된다.,넌 그 동아리에 가입하면 안 된다.,그들은 매일 너와 같이 a 나무 위에 사니?,나는 그녀의 소형차를 천천히 운전하지 않는다.,그들이 a 단체 할인을 받습니까?,그가 너에 관하여 걱정하려고 하니?,그는 이번 금요일 a 여자 친구를 사귀려고 한다.,그들은 그녀에게 수화를 가르치려고 하니?,그들은 the 차가운 거리에서 잠을 자려고 한다.,그들은 나를 the 병원에 데려가려고 합니까?,그녀가 그녀의 손가락으로 a 동그라미(circle)를 그릴 수 있니?,난 그 까다로운 퀴즈를 이해할 수 있다.,넌 스팸메일을 열고 그 링크에 클릭했니?,난 작년에 a 검은 장미를 먹었다. ,제는 그의 성공을 위해서 기도 했습니다. ,난 만약의 경우를 생각해서 the 앞문을 열지 않았다.,그는 a 날아가는 비행기를 그의 손s으로 잡을 수 있었다.,넌 나의 결혼반지를 팔 수 없었다.,제가 저 소금을 맛보아도 되나요?,나의 개와 the 길을 건너라!
1,제가 당신의 애완동물을 천천히 쓰다듬어도 됩니까?,넌 the 곰의 별명을 바꿔도 돼.,넌 나의 비자금을 훔치면 안 된다.,그들은 밖에서 그녀의 영어책을 읽니?,우리는 매년 명품 차를 타고 부처님(buddha)에게 간다. ,그들은 a 단체 할인을 받는다.,그녀는 a 위대한 피아니스트가 되려고 하니?,그는 내일 너의 거실을 청소하려고 하지 않는다.,그들은 올해 가족을 위해 담배를 끊으려고 하니?,우리는 9시 이후엔 나가지 않으려고 한다.,그들은 너를 the 병원에 데려가려고 해.,그가 그의 팔꿈치로 a 삼각형(triangle)을 그릴 수 있니?,넌 그녀에게 하얀 커피를 줄 수 없어.,넌 그녀의 자전거를 타고 the 은행에 갔니?,난 the 파티에서 a 노래를 불렀다.,난 독일에 이틀 전에 도착했다. ,난 그에게 도전하지 않았어.,넌 그의 형님과 같이 일을 할 수 있었다.,그는 그녀의 일기(diary)를 나에게 보여줄 수 없었다.,네가 거기에서 감자s를 사면 안 된다.,네가 computer games을 그들과 하는 것이 어때!
2,제가 당신의 목걸이를 사용해도 됩니까?,넌 온라인으로 an 못생긴 돼지를 주문해도 돼.,넌 그녀를 on the 거리에서 만나면 안 된다.,그들이 아침마다 물을 끓이니?,그들은 매일 밤 그녀의 집을 방문하지 않는다.,그들은 a 단체 할인을 받지 않는다.,그는 방과 후 버스 타고 그녀의 집에 가려고 하니?,그녀는 내일 the 토끼를 나에게 주려고 한다.,그들은 a 소름 끼치는 테러리스트를 만나려고 하니?,그들은 a 조용한 방에서 나랑 음악을 공부하려고 한다.,그들은 너를 the 병원에 데려가려고 하지 않는다.,내일 그들이 저를 만날 수 있을까요?,그가 나의 방에서 그의 바지s를 바꿔 입을 수 있어.,넌 어제 the 문을 닫고 그것을 잠갔니?,난 여기서 너의 친구를 여기서 만났다.,난 삼 일s 전에 그의 코를 후벼주었다. ,나는 그가 그녀에게 도전하는 것을 도와주지 않았다.,난 the 까다로운 영어질문을 이해할 수 있었다.,그녀는 미국에서 the 미국인을 만날 수 없었다.,그들은 매일 그들의 신용카드를 사용합니까?,당신은 제를 위해 기도해 주시겠습니까? 
3,제가 당신의 딸에게 제의 영어책을 줘도 됩니까?,넌 저것을 영어로 하얀 바나나라고 불러도 돼.,넌 간식(snack)으로 감자s를 먹으면 안 된다.,그들은 매일 오후 간식으로 감자s를 먹니? ,나는 목요일마다 서두른다.,제가 the 교실에서 an 외투를 벗어도 됩니까?,그는 3시간s 동안 그들과 공부하려고 하니?,그녀는 the 가위 바위 보에서 바위를 내려고 하지 않는다.,그들은 시멘트를 물로 섞으려고 하니?,우리는 너의 아빠를 숨겨주지 않으려고 한다.,그녀가 a 개에게 the 최고의 노래를 가르치려고 합니까?,그들은 오늘 밤 너의 아기를 돌보아 줄 수 있니?,그녀는 내가 버스s 갈아타는 것을 도와줄 수 있습니다.,넌 작년에 a game 매니아와 같이 놀았니?,난 그녀와 the 문제를 해결했다.,나는 사 일s 전에 머리를 감았습니다. ,난 만약의 경우를 대비하여 그의 배를 힘껏 누르지 않았다.,그녀는 a 유명한 주방장을 the 부엌에서 만날 수 있었다.,그는 그의 더러운 수건으로 나의 눈물s을 닦아 줄 수 없었다.,그녀가 그 과학책을 편집하려고 합니까?,on the 길에 쓰레기를 버리지 마세요!
4,제가 당신 어깨s 위에 앉아도 됩니까?,넌 너 자신을 우리에게 소개해도 된다.,넌 the 흰색 벽 위에 있는 the 파리를 죽이면 안 된다.,그들이 매일 제녁 너의 도움이 필요하니?,우리는 목요일마다 그들과 의학 공부를 하지 않는다.,네가 the 교실에서 an 외투를 벗어도 된다.,그녀가 10시간s 동안 벨리 춤을 추려고 하니?,그녀는 the 빵을 그녀의 머리 위에 놓으려고 해.,그들은 나의 숙제를 베끼려고 하니?,그들은 겨울에 a 큰 보트를 만들려고 한다. ,그녀가 a 개에게 the 가장 좋은 노래를 가르치려고 해. ,그가 장미s로 a 꽃다발을 만들 수 있을까?,그들은 a 기분 전환으로 그들의 휴대폰s을 바꿀 수 있다.,넌 담배 연기로 a 아름다운 구름을 만들었니? ,난 설탕으로 설탕 차를 만들었다.,나는 그 답을 오 일s 전에 기억했습니다. ,난 모래로 a 의자를 만들지 않았다.,그들은 그의 마스크를 씻어 줄 수 있었다.,그들은 여기서 a 악취 나는 skunk를 키울 수 없었다.,그들은 우리에게 the 기본적인 윤곽을 설명하려고 한다.,더러운 손s으로 음식 먹지 마!
5,제가 당신의 쇼핑 카트를 밀어도 됩니까?,넌 나의 명품 차를 설탕물로 씻어도 돼.,넌 the 오후에 그 나무에 물을 주면 안 된다.,그들은 매시간 한 손으로 너의 차를 운전하니?,그들은 물고기를 아점으로 먹지 않는다.,네가 the 교실에서 an 외투를 벗으면 안 된다.,그녀가 a 신비한 나무를 너에게 팔려고 하니?,그녀는 너에게 the 모의고사에 관하여 이야기하려고 한다.,그들은 나의 나라를 위해 열심히 싸우려고 하니?,우리는 거기에서 감자s를 사지 않으려고 한다.,그녀가 나에게 the 최고의 노래를 가르치려고 하지 않는다.,그녀가 이 어려운 퀴즈를 해결할 수 있을까?,우리가 the 성적표를 너에게 줄 수 있다. ,넌 어제 a 황당한 스팸메일을 받았니?,난 그녀의 고물 자전거를 타고 the 바다에 갔다.,전 the 쓰레기를 the 펜스 넘어 던졌습니다. ,난 rocket 타고 the 지상천국에 가지 않았다.,우리는 the 오래된 소나무 위에서 노래할 수 있었다.,우리는 오늘 오후에 그 레몬 나무에 심을 수 없었다.,우리가 9시 이후엔 밖에 나갈 수 있니?,넌 타자 치는 것을 지금 마쳐야 하니?
6,제가 물을 마셔도 되나요?,넌 이제 안경s 없이 the 태양을 바라보아도 된다.,넌 그들의 정원에서 놀면 안 된다.,그들은 월요일마다 나의 몸무게를 확인하니?,우리는 매년 the 섬(island)에서 a 흰색 호랑이를 사냥한다.,그들은 일요일s 마다 교회에 갑니까? ,그녀가 the 말썽꾸러기를 너희 집에 초대하려고 하니?,그는 a 새 복사기를 사지 않으려고 한다.,그들은 나의 오른쪽 장갑을 끼려고 하니?,그들은 그녀에게 온 the 메시지를 확인하려고 한다.,그가 올해 장미s를 키우려고 합니까?,그녀가 나에게 the 꽃다발을 던질 수 있니?,나는 그런 경우에는 a 짧은 치마를 입을 수 있어.,넌 어제 the 펜스를 넘었니?,난 어제 the 고장 난 창문을 열었다.,나는 일주일 전에 그에게 전화했습니다.,난 작년에 돼지고기를 먹지 않았다.,그는 지난 월요일에 the fan club에 가입할 수 있었다.,그는 소금으로 맛있는 chocolates을 만들 수 없었다.,너는 the 박물관에서 너의 휴대폰을 켰니?,태양에너지를 이용하자!
7,제가 당신에게 제 자신을 소개해도 됩니까?,네가 그 번호를 눌러도 돼.,넌 an 지우개를 나에게 던지면 안 된다.,그들은 검은 얼음으로 a 노란색 눈사람을 만드니?,그들은 매일 the 운동장에서 a 야구방망이를 휘두른다.,그들은 일요일s 마다 교회에 갑니다. ,그는 the 가위바위보 게임을 하려고 하니?,그는 a 웨딩드레스를 다음 주에 사려고 한다.,그들은 내일 너의 담임선생님을 만나려고 하니?,우리는 나란히 눕지 않으려고 한다.,그가 올해 장미s를 키우려고 한다.,그가 a 힘센 거미와 a 나무 위에서 싸울 수 있니?,그는 the 학교로 빨리 달려갈 수 없다.,넌 a 수건을 the 펜스 넘어 던졌니?,난 the 음악에 맞춰 춤을 추었다.,난 the 건물 넘어 a 공을 던졌다. ,난 the 시험에 떨어지지 않았다.,그녀가 작년에 아프리카에서 a 눈사람을 만들 수 있었다.,그녀는 the 올림픽s에서 a 금메달을 딸 수 없었다.,그들은 a 조용한 방에서 나랑 음악을 공부했다.,넌 영어를 잘 말할 수 없니?
8,제가 당신의 영어책을 꺼내도 됩니까?,네가 the 꽃s에 물을 줘도 돼.,넌 지금 잠에서 깨면 안 된다. ,그들은 화요일마다 너에게 a 현기증 나는 질문을 하니? ,그들은 아침마다 저 나무 아래에서 설거지를 안 해.,그들은 일요일s 마다 교회에 가지 않습니다. ,그녀는 the 가위바위보 게임에서 바위를 내려고 하니?,그녀는 그녀의 화난 얼굴을 a 바위 위에 그리려고 한다.,그들은 the 안과 의사를 8시 후에 만나려고 하니? ,나는 빈 깡통s을 나란히 놓으려고 한다.,그는 올해엔 장미s를 키우려고 하지 않는다. ,그들이 그의 중요한 이야기를 잊어버릴 수 있을까?,그들은 그의 나쁜 버릇을 오해할 수 있어.,너는 그에게 전화하는 것을 잊어버렸니?,나는 2년 전에 그의 이름을 잊어버렸다. ,난 어제 a 큰 눈사람을 만들었습니다. ,나는 만약을 위해 그녀에게 새로운 정보를 주지 않았다.,우리는 the 물속에서 너에게 전화할 수 있었다.,넌 나를 깨울 수 없었다.,나는 나의 건강을 위해 많은 커피를 마시지 않았다.,넌 a 감기에 걸려야만 해.
9,제가 저 신사를 밖에서 만나도 됩니까?,네가 이제 이것을 마쳐도 돼.,넌 겨울에 밖에서 자면 안 된다.,그들은 화요일마다 너의 책s을 버리니?,우리는 저녁마다 그의 가족과 TV를 본다.,제가 당신의 문신을 제거해도 됩니까?,그녀가 the 가위바위보 게임에서 가위s를 내려고 하니?,그녀는 나랑 a 눈싸움을 하려고 하지 않는다.,그들은 정각에 the 안과 의사를 만나려고 하니?,그들은 나의 느린 공을 잡으려고 해.,그들이 나의 열쇠를 the 책상 아래에 놓아두려고 합니까?,그가 그의 머리를 너의 머리 위에 놓을 수 있니?,난 그의 멍든 눈을 기억할 수 있다.,네가 the 화면을 건드렸니?,난 the 첨단미사일을 사용했다.,난 이틀 전에 이 건물을 지었습니다. ,나는 그들과 a 좋은 시간을 보내지 않았다.,난 어제 너의 집에서 잘 수 있었다. ,그들은 the 바쁜 새와 살 수 없었다.,그들은 나에게 에티켓을 배우길 원한다.,a 축축한 곳에 the 비누를 놓아두지 말자!
10,제가 당신을 현기증 나는 개라고 불러도 됩니까?,넌 이제 나의 도움 없이 노래하고 춤을 춰도 된다.,넌 오늘 the elevator를 타면 안 된다.,그들은 너에 관하여 조금 알고 있니?,난 매일 저녁 나의 귀여운 고양이와 논다.,넌 나의 문신을 제거해도 된다.,그는 점심 후에 돈 걱정을 하려고 하니? ,그는 영원히 그녀와 살지 않으려고 한다.,그들이 처음으로 술을 끊으려고 하니?,나는 수업하기 전에 the 화장실을 청소하지 않으려고 한다.,그들은 너의 열쇠를 the 책상 아래에 놓아두려고 해.,그녀가 너의 일본어를 이해할 수 있니?,우리는 the 같은 책을 일본에서 살 수 없어.,너는 the 골대s를 지난밤에 옮겼니?,나는 너의 축구팀을 응원했다.,나는 a 큰 붓으로 a 아름다운 장면(scene)을 그렸습니다. ,난 거기서 너의 친구를 만나지 않았다.,그는 너의 노래에 맞추어 춤을 출 수 있었다.,그녀는 a 최첨단 기술 회사를 찾을 수가 없었다.,그들은 어제 허튼소리를 하지 않았다.,당신 차에 제의 용돈을 숨겨주세요!
11,제가 a gorilla에게 이 매운 고추를 보여줘도 됩니까?,네가 이 책을 가져가서 그것을 태워도 된다. ,넌 the 진흙 속에서 입을 벌리면 안 된다.,그들이 수요일마다 너를 만나니?,그들은 매일 아침 나의 아빠와 야구하지 않는다. ,넌 나의 문신을 제거하면 안 된다.,그는 제녁 후에 커피 한 잔을 마시려고 하니?,그는 이번 월요일에 the 꽃집에 가려고 하지 않는다.,그들은 안전(safety)을 위해 a helmet을 쓰려고 하니?,우리는 내년에 우리의 고향으로 돌아가려고 한다.,그들이 너의 열쇠를 the 책상 아래에 놓아두려고 하지 않아.,그들은 그녀의 영어를 이해할 수 있을까?,그는 그의 오른쪽 어깨로 세수할 수 있다.,너는 지난밤 a 환상적인 꿈을 꾸었니?,나는 지난밤 a 좋은 꿈을 꿨다.,제는 당신의 성공(success)을 위해 그것을 했습니다. ,나는 갑자기 the 뒷문을 닫지 않았다.,그들은 the 장마철에 많은 우산s을 팔 수 있었다.,그는 the 스모그 속에서 그의 입을 벌릴 수 없었다.,제가 당신의 성적표를 보아도 됩니까?,넌 매일 버스타고 the 감옥에 가니?
12,넌 the 짠 바나나를 제 원숭이에게 팔아도 됩니까?,네가 그녀에게 나의 일기(diary)를 보여줘도 돼.,넌 쓰레기를 on the 거리에 버리면 안 된다.,그들이 수요일마다 함께 만나니? ,그들은 a 비가 오는 날 a 눈사람을 만든다. ,그들은 매일 아침 the 불쌍한 아기를 돌봅니까? ,그녀는 a 터널 안에서 떠들려고 하니?,"그는 오늘 제녁에 the 여왕을 만나려고 한다,",그들은 그들의 폐를 위해서 a 마스크를 끼려고 하니?,우리는 올림픽s에서 the 금메달을 따려고 한다.,우리가 내년에 the 미국(USA)으로 이사 가려고 하니?,그가 우리의 꿈을 알 수 있을까?,우리는 매일 a 울고 있는 나무에 관해 생각할 수 있어. ,넌 갑자기 a 연필을 꺼냈니?,난 그에게 수영을 가르쳤다.,난 the 높은 산 위에서 피아노를 쳤습니다. ,난 그녀와 수영하러 가지 않았다.,우리는 the 게임을 a 학생에게 소개할 수 있었다.,우리는 그들과 a 눈싸움을 할 수 없었다.,네가 나의 신문을 그녀에게 줘도 된다.,넌 그 이야기를 영어로 설명할 수 있니? 
13,제가 오늘 여기에 머물러도 되나요?,네가 너의 안과 의사를 여기서 만나도 된다.,넌 붉은 소금으로 a 눈사람을 만들면(build) 안 된다. ,그들은 수요일마다 a 잡지(magazine)를 읽니? ,우리는 a 눈 오는 날 축구를 하지 않는다.,그들은 매일 아침 the 불쌍한 아기를 돌본다.,그녀는 내일 the 치과의사를 만나려고 하니?,그가 다음 수요일에 그것을 하려고 하지 않는다.,그들은 그들의 미래를 위해 열심히 일하려고 하니?,그들은 올림픽s에서 the 동메달을 따려고 한다.,우리는 내년에 the 미국으로 이사 가려고 한다.,그녀가 그녀의 꿈을 일본어로 설명할 수 있을까?,나는 a 신품 다이아몬드 반지를 전시할 수 없다.,너는 그와 같이 a 좋은 휴가를 보냈니?,나는 그와 같이 a 환상적인 시간을 가졌다.,제는 그의 금반지를 그녀에게 팔았습니다. ,난 그의 생일 파티에서 Hallelujah를 부르지 않았다.,그는 the 물 위에 안전하게 살 수 있었다.,난 어제 전혀 쉴 수 없었다.,그녀가 방과 후 the 화장실을 청소하려고 합니까?,전 당신에게 오늘 밤 전화를 드리고 싶습니다.
14,제가 당신의 돈을 여기에 숨겨도 됩니까?,네가 나의 사랑스러운(lovely) 호랑이를 그들에게 팔아도 된다.,넌 a 잠자는 아기를 쓰다듬으면 안 된다.,그들이 매시간 the 벽 위에 너의 얼굴을 그리니? ,그들은 a 바람 부는 날에 쓰레기를 버린다. ,그들은 매일 아침 the 불쌍한 아기를 돌보지 않는다.,그는 너의 삼촌을 the 섬에 데려가려고 하니?,그녀는 내일 너를 위해서 어떤 일을 하려고 한다.,그들은 그들의 이를 위해 a 마우스피스를 사려고 하니?,난 너의 휴대폰을 켜려고 한다.,우리는 내년에 the 미국으로 이사 가지 않으려고 한다.,그들이 그것을 너에게 쉽게 설명할 수 있을까?,너는 이 할인권을 어디서든 사용할 수 있다. ,너는 그녀에게 너의 근육을 보여주었니?,나는 그녀에게 우리의 책을 주었다.,난 오늘 아침 일찍 일어났다. ,나는 만약을 대비하여 그의 비번을 잊어버리지 않았다.,그녀는 매일 그 이야기를 들을 수 있었다.,넌 그녀의 맛있는 반찬(side dish)을 맛볼 수 없었다.,그녀가 나의 빠른 공을 잡을 수 있습니까?,난 너의 지우개를 사용해야만 했다. 
15,,,,,,,,,,,,,,,,,,,,,
16,,,,,,,,,,,,,,,,,,,,,
17,,,,,,,,,,,,,,,,,,,,,
18,,,,,,,,,,,,,,,,,,,,,
19,제가 당신의 데이터를 사용해도 됩니까?,넌 우리와 the 정원에서 일을 해도 된다.,넌 오늘 밤 그들과 싸움하면 안 된다.,그들이 매일 밤 너의 집에서 잠자니?,그들은 a 화창한 날에 그들 집에서 잠을 잔다.,제가 물을 마셔도 됩니까? ,그는 자기 전에 그것을 하려고 하니?,그가 the 안개 속에서 a 차를 운전하려고 한다.,그들은 the 동물원에서 도망가려고 하니?,난 오늘 밤 너에게 a 꽃을 갖다주려고 한다.,그들은 그것을 영어로 설명하려고 합니까?,그가 그녀의 거실을 내일 청소 할 수 있니?,그들은 the 쓰레기를 거기서 태울 수 없다.,넌 이 넓은 교실을 어제 청소했니?,나는 제 깨끗한 교실을 어제 청소했다. ,내가 너의 흰색 코코아를 마셨다. ,제는 여기에서 a 팝송을 배우지 않았습니다.,너는 한국인에게 a 전설적인 인물이 될 수 있었다.,그는 the 말도 안 되는 퀴즈를 풀 수 없었다.,제가 당신을 a사진 찍어도 됩니까?,제가 당신을 a사진 찍어도 됩니까?
20,제가 당신을 영원히 잊어버려도 됩니까?,넌 여기서 슬리퍼s를 신어도 돼.,넌 그녀의 눈썹s을 교환하면 안 된다.,그들이 너의 달리기 속도를 알고 있니? ,그들은 a 바람 부는 날에 쓰레기를 태우지 않는다.,넌 물을 마셔도 된다.,그는 내일 아침에 나를 깨우려고 하니?,그녀는 a 더러운 돼지에게 뽀뽀하려고 하지 않는다. ,그들은 그와 the 빗속에서 수영 하려고 합니까?,난 이 결정적인 증거(smoking gun)를 the 판사에게 보여주지 않으려고 한다.,그들은 그것을 영어로 설명하려고 한다.,그녀가 그녀의 머리를 a 헤어드라이어로 말릴 수 있니?,우리는 the 고장 난 브레이크를 부술 수 있다. ,당신은 나의 문자 메시지를 읽었습니까?,나는 an 쉬운 영어책을 읽었다. ,십 년s 전 나는 그곳에 살았다. ,내가 너의 주소를 어제는 몰랐다.,그는 the 흰색 개구리처럼 빠르게 점프할 수 있었다.,그녀는 가출할 수 없었다.,그녀가 the 물위에서 수상스키를 타려고 합니까?,그녀가 the 물위에서 수상스키를 타려고 합니까?
21,제가 그것을 차례대로 해도 됩니까?,넌 너의 아빠를 지금 깨워도 된다.,넌 가출하면 안 된다.,그들은 회원증s을 가지고 있니?,우리는 a 구름 낀 날에 the 태양을 바라본다.,넌 물을 마시면 안 된다.,그는 너에게 an 영어질문을 하려고 하니?,그녀는 다음 일요일 the 공포(horror)영화를 보려고 하지 않는다.,그들은 the 눈 속에서 골프를 치려고 합니까?,그들은 a 버릇없는 아빠와 예절을 공부하려고 한다.,그들은 그것을 영어로 설명하려고 하지 않는다.,그들이 the 중요한 약속(appointment)을 이번엔 지킬 수 있을까요?,이런 경우엔 그녀의 엄마가 a 가계에서 담배s를 살 수 있다.,너는 지난주에 the 최종영어시험에서 떨어졌니?,내가 너의 과학 숙제를 했다. ,제는 삼 일s 전에 담배를 끊었습니다. ,제는 삼 일s 전에 담배를 끊지 않았습니다.,그녀는 그녀의 건강을 위해 깨끗한 물을 마실 수 있었다.,그는 만약을 대비해서 그의 아빠를 개구리라고 부를 수 없었다.,그들은 주말마다 the 수족관에 가니?,그들은 주말마다 the 수족관에 가니?
22,제가 그들의 생활방식을 바꿔도 됩니까?,넌 내가 a 요리책(recipe book)사는 것을 도와줘도 돼.,넌 그녀의 무서운 삼촌과 결혼하면 안 된다.,그들이 매일 새로운 정보를 이용하니?,그들은 a 추운 날에 an 아이스크림을 시베리아에서 판다.,그들은 a 눈 오는 날에 a 눈싸움을 하나요? ,그녀는 a 도둑을 따라가려고 하니?,그는 다음 금요일에 설탕물을 끓이려고 한다.,그들은 그녀의 사진을 페이스북에 올리려고 합니까?,우리는 그들을 주먹으로 치지 않으려고 한다.,그가 오늘 밤 the 외로운 나무를 안아 주려고 합니까?,그가 the 뜨거운 젓가락s을 만질 수 있니?,우리는 the 원래 계획을 변경할 수 없다. ,넌 이 큰 구름으로 많은 비를 만들었니?,난 이 야구방망이로 the 구름을 때렸다. ,난 the 어려운 영어시험에 합격했다. ,내가 너의 도움에 감사하지 않았다.,우리는 지난봄에 용돈을 좀 벌 수 있었다.,우리는 그의 노래를 더 이상 들을 수 없었다.,그들은 the 안개 속에서 a 대형 트럭을 운전할 수 없다.,그들은 the 안개 속에서 a 대형 트럭을 운전할 수 없다.
23,제가 이것을 영어로 ‘브레드’라고 불러도 됩니까?,넌 너의 생활방식을 완벽하게 바꿔도 돼.,넌 그녀를 the 감옥(prison)에서 만나면 안 된다.,그들이 월요일마다 점심으로 밥을 먹니?,우리는 a 비 오는 날 우리들의 비옷을s 벗는다.,그들은 a 눈 오는 날에 a 눈싸움을 해.,그녀는 그녀의 왼쪽 귀를 조심스럽게 당기려고 하니?,그녀는 내일 그 영어사전(dictionary)을 사용하지 않으려고 한다.,그들은 나의 넓은(wide)얼굴을 a 사진을 찍으려고 합니까?,그들은 나의 개를 괴롭히지 않으려고 한다.,그가 오늘 밤 the 외로운 나무를 안아 주려고 한다.,그녀가 너의 용돈을 그녀의 주머니 속에 숨길 수 있니?,그들은 미사일을 타고 a 신세계에 갈 수 없다.,넌 그녀에게 an 중요한 message를 받았니?,난 당신의 문자 메시지를 한 시간 전에 확인했다. ,제가 제 나무를 키웠습니다. ,나는 서울에서 하룻밤을 보내지 않았어.,나는 가위바위보에서 바위를 낼 수 있었다.,넌 지난 금요일에 그녀의 사물함을 수리할 수 없었다.,그들은 나를 위해 담배를 끊으려고 하니?,그들은 나를 위해 담배를 끊으려고 하니?
24,제가 그녀의 비번을 사용해도 됩니까?,넌 a 연필을 이 나무로 만들어도 돼.,넌 나의 아기의 나체 사진을 다운로드하면 안 된다.,그들은 일요일마다 하나님을 용서해 주니?,그들은 그들의 결혼식 날 운다.,그들은 a 눈 오는 날 a 눈싸움을 하지 않는다.,그는 저 호박을 맛있게 먹으려 하니?,그녀는 이번 화요일 그의 목걸이를 가져오려고 한다.,그들은 그녀의 집을 a 사진을 찍으려고 합니까?,우리는 the 시끄러운 파리를 잡지 않으려고 한다.,그는 오늘 밤 the 외로운 나무를 안아 주려고 하지 않는다.,그들이 나를 일본어로 소개할 수 있니? ,그녀가 a 붓으로 너의 얼굴을 the 벽지에 그릴 수 있다.,넌 an 독수리처럼 낮게 날았니?,내가 그녀의 할인 쿠폰을 훔쳤다. ,내가 너의 주소를 어제 알았어. ,제가 작년 가을에 제 나무를 키우지 않았습니다.,넌 어제 the 날짜를 확인 할 수 있었다.,그녀는 그 막대사탕을 그들에게 팔 수 없었다.,우리는 그에게 the 신문을 빌릴 수 없다.,우리는 그에게 the 신문을 빌릴 수 없다.
